datetime,title,link,summary
2023-01-06,"[""In the wake of Unity Software Inc.'s (NYSE:U) latest US$1.0b market cap drop, institutional owners may be forced to take severe actions - Simply Wall St"", 'Astec Industries CEO Barry Ruffalo Steps Down; Names Jaco Van ... - Nasdaq', ""Gruene's Adobe Verde to reopen in February under new owners - mySA"", 'DoorDash: Uncertain Prospects, Poor Risk/Reward (NYSE:DASH) - Seeking Alpha', 'Is the S&P 500 All You Need to Retire a Millionaire? - Nasdaq', 'Adobe Inc ADBE Technical Pivots with Risk Controls - Stock Traders Daily', 'Congresswoman Virginia Foxx Recently Traded These 3 Stocks - Nasdaq', 'Adobe Stock (NASDAQ:ADBE): Prepare for Its Comeback - TipRanks']","['https://news.google.com/rss/articles/CBMigAFodHRwczovL3NpbXBseXdhbGwuc3Qvc3RvY2tzL3VzL3NvZnR3YXJlL255c2UtdS91bml0eS1zb2Z0d2FyZS9uZXdzL2luLXRoZS13YWtlLW9mLXVuaXR5LXNvZnR3YXJlLWluY3MtbnlzZXUtbGF0ZXN0LXVzMTBiLW1hcmtldNIBhAFodHRwczovL3NpbXBseXdhbGwuc3Qvc3RvY2tzL3VzL3NvZnR3YXJlL255c2UtdS91bml0eS1zb2Z0d2FyZS9uZXdzL2luLXRoZS13YWtlLW9mLXVuaXR5LXNvZnR3YXJlLWluY3MtbnlzZXUtbGF0ZXN0LXVzMTBiLW1hcmtldC9hbXA?oc=5', 'https://news.google.com/rss/articles/CBMidGh0dHBzOi8vd3d3Lm5hc2RhcS5jb20vYXJ0aWNsZXMvYXN0ZWMtaW5kdXN0cmllcy1jZW8tYmFycnktcnVmZmFsby1zdGVwcy1kb3duLW5hbWVzLWphY28tdmFuLWRlci1tZXJ3ZS1wcmVzaWRlbnQtY2Vv0gEA?oc=5', 'https://news.google.com/rss/articles/CBMiSWh0dHBzOi8vd3d3Lm15c2FuYW50b25pby5jb20vZm9vZC9hcnRpY2xlL2dydWVuZS1hZG9iZS12ZXJkZS0xNzY5NDY3NS5waHDSAQA?oc=5', 'https://news.google.com/rss/articles/CBMiVWh0dHBzOi8vc2Vla2luZ2FscGhhLmNvbS9hcnRpY2xlLzQ1NjgyNzktZG9vcmRhc2gtdW5jZXJ0YWluLXByb3NwZWN0cy1wb29yLXJpc2tyZXdhcmTSAQA?oc=5', 'https://news.google.com/rss/articles/CBMiVWh0dHBzOi8vd3d3Lm5hc2RhcS5jb20vYXJ0aWNsZXMvaXMtdGhlLXNwLTUwMC1hbGwteW91LW5lZWQtdG8tcmV0aXJlLWEtbWlsbGlvbmFpcmUtMTDSAQA?oc=5', 'https://news.google.com/rss/articles/CBMid2h0dHBzOi8vbmV3cy5zdG9ja3RyYWRlcnNkYWlseS5jb20vbmV3c19yZWxlYXNlLzc4L0Fkb2JlK0luYytBREJFK1RlY2huaWNhbCtQaXZvdHMrd2l0aCtSaXNrK0NvbnRyb2xzXzAxMDYyMzAyMDAwMS5odG1s0gEA?oc=5', 'https://news.google.com/rss/articles/CBMiWmh0dHBzOi8vd3d3Lm5hc2RhcS5jb20vYXJ0aWNsZXMvY29uZ3Jlc3N3b21hbi12aXJnaW5pYS1mb3h4LXJlY2VudGx5LXRyYWRlZC10aGVzZS0zLXN0b2Nrc9IBAA?oc=5', 'https://news.google.com/rss/articles/CBMiVWh0dHBzOi8vd3d3LnRpcHJhbmtzLmNvbS9uZXdzL2FydGljbGUvYWRvYmUtc3RvY2stbmFzZGFxYWRiZS1wcmVwYXJlLWZvci1pdHMtY29tZWJhY2vSAQA?oc=5']","[""As a result, if the decline continues, institutional investors may be pressured to sell Unity Software which might hurt individual investors.\nLet's take a closer look to see what the different types of shareholders can tell us about Unity Software.\nUnity Software already has institutions on the share registry.\nWe note that hedge funds don't have a meaningful investment in Unity Software.\nPrivate Company OwnershipIt seems that Private Companies own 6.8%, of the Unity Software stock."", '(RTTNews) - Astec Industries Inc. (ASTE) said Friday that Barry Ruffalo has stepped down as President and Chief Executive Officer and as a member of the Board of Directors, effective immediately.\nThe company noted that it has appointed Jaco van der Merwe as President and Chief Executive Officer and as a member of the Astec Industries Board of Directors.\nvan der Merwe joined Astec in 2016 as Group President and currently serves as Group President - Infrastructure Solutions, a role he assumed in 2019.\nThe views and opinions expressed herein are the views and opinions of the author and do not necessarily reflect those of Nasdaq, Inc.', 'Adobe Verde was closed down in late November 2022, but with new ownership leading the way, the Gruene Tex-Mex restaurant will reopen on February 1.\nWe would come up with friends, kids would run around and families would eat and have margaritas,"" said Adobe Verde owner Bob Wilson.\nOne thing he heard from people on social media that used to frequently visit Adobe Verde was to not change a fan favorite.\nThe restaurant will still serve nachos, quesadillas, fajitas, enchiladas, tacos, and chili relleno, according to the Adobe Verde website.\nY’all are going to turn Adobe Verde into the great restaurant it use to be!', ""It's uncertain whether or not DoorDash can ever achieve GAAP profitability without a significant rethink of the business.\nAnd right now many of those people have an unfavorable view of DoorDash's business model.\nIf DoorDash is unable to realize significant operating leverage their business model is broken.\nRisk/Reward Highly UnfavorableI wouldn't touch DoorDash, Inc. stock with a ten foot pole at these levels.\nWe struggle to find a reason to own the stock until they can prove their business model is viable and can achieve GAAP profitability."", ""Covering your basesThe S&P 500 is an index, but different companies put together their respective S&P 500 exchange-traded funds (ETFs) to mirror it.\nHere are some companies and their respective funds:Vanguard: Vanguard S&P 500 ETF (NYSEMKT: VOO)BlackRock: iShares Core S&P 500 ETF (NYSEMKT: IVV)State Street Global: SPDR S&P 500 ETF Trust (NYSEMKT: SPY)Since they track the same index, there isn't much tangible difference between S&P 500 ETFs outside the expense ratio, which is charged annually as a percentage of your total investment.\nFor example, the Vanguard S&P 500 ETF has a 0.03% expense ratio, but the SPDR S&P 500 ETF Trust's expense ratio is 0.0945%.\nBut if you're focused on the long term, you can trust the S&P 500 to carry you to millionaire land.\nSee the 10 stocks*Stock Advisor returns as of December 1, 2022Stefon Walters has positions in Vanguard S&P 500 ETF."", 'Adobe Inc ADBE Technical Pivots with Risk ControlsLonger Term Trading Plans for ADBEBuy ADBE slightly over 294.47 target 353.71 stop loss @ 293.62 DetailsThe technical summary data tells us to buy ADBE near 294.47 with an upside target of 353.71.\n294.47 is the first level of support below 332.78 , and by rule, any test of support is a buy signal.\nShort ADBE slightly under 353.71, target 294.47, stop loss @ 354.73 Details The technical summary data is suggesting a short of ADBE as it gets near 353.71 with a downside target of 294.47.\nBecause this plan is a short plan based on a test of resistance it is referred to as a Short Resistance Plan.\nBecause this plan is a short plan based on a test of resistance it is referred to as a Short Resistance Plan.', 'Our data shows hedge funds sold 248.2K DUK shares last quarter.\nAlong with Foxx, hedge funds have also acquired VGR stock.\nHowever, insiders sold VGR stock worth $12.4M.\nMeanwhile, insiders sold HES stock worth $8.4M.\nAccording to TipRanks, VGR and HES stocks are likely to outperform the broader market averages.', 'I am bullish on Adobe stock because investors haven’t yet factored in the company’s resilience in 2022 and comeback potential for 2023.\nThis unfortunate development, along with the market’s general anxiety about technology stocks, may have clouded investors’ judgment about ADBE stock.\nAdobe Posted Excellent Quarterly Financial ResultsThe most bullish argument in favor of owning ADBE stock comes from the company’s financial data.\nConclusion: Should You Consider Adobe Stock?\nQuarter after quarter, Adobe has met or beaten the analyst community’s EPS forecasts – yet, ADBE stock is trading at a reasonable price.']"
2023-01-07,"['Is Adobe using your photos to train its AI? It’s complicated - TechCrunch', 'ServiceNow: Growing Strongly, But Is Now Time To Back Up The ... - Seeking Alpha', '40 Best Stocks to Buy With High Upside in 2023: Goldman Sachs - Business Insider']","['https://news.google.com/rss/articles/CBMiXWh0dHBzOi8vdGVjaGNydW5jaC5jb20vMjAyMy8wMS8wNi9pcy1hZG9iZS11c2luZy15b3VyLXBob3Rvcy10by10cmFpbi1pdHMtYWktaXRzLWNvbXBsaWNhdGVkL9IBYWh0dHBzOi8vdGVjaGNydW5jaC5jb20vMjAyMy8wMS8wNi9pcy1hZG9iZS11c2luZy15b3VyLXBob3Rvcy10by10cmFpbi1pdHMtYWktaXRzLWNvbXBsaWNhdGVkL2FtcC8?oc=5', 'https://news.google.com/rss/articles/CBMiX2h0dHBzOi8vc2Vla2luZ2FscGhhLmNvbS9hcnRpY2xlLzQ1Njg0Nzctc2VydmljZW5vdy1ncm93aW5nLWdyZWF0LXNvZnR3YXJlLXN0b2NrLWxvbmctdGVybS1ob2xk0gEA?oc=5', 'https://news.google.com/rss/articles/CBMiZWh0dHBzOi8vd3d3LmJ1c2luZXNzaW5zaWRlci5jb20vaW52ZXN0aW5nLXN0b2Nrcy10by1idXktbm93LW1hcmtldC1yYWxseS1vdXRsb29rLWdvbGRtYW4tc2FjaHMtMjAyMy0x0gEA?oc=5']","['But the wording of the setting is clear: It may analyze your content using machine learning not for the purposes of training machine learning.\nIn Photoshop, machine learning can be used to automatically correct the perspective of an image for you.\nA machine learning analysis would also allow Adobe to tell how many people were using Photoshop to, say, edit images of people versus landscapes, or other high-level metadata.\nIn fact, Adobe has a program specifically for doing that: the Adobe Photoshop Improvement Program, which is opt-in and documented here.\nBut it’s entirely possible that your photos are, through one tube or another, being used as content to train a generative AI.', 'Differentiated product offeringMany of the characteristics that differentiate ServiceNow\'s products have been discussed above under the heading ""Why customers buy from ServiceNow?""\nFigure 19 Free cash flow marginsCreated by authoring using public financial dataHowever, its Q3 free cash flow was down to 2018 levels.\nFigure 22 Return on tangible capitalCreated by author using public financial dataValuationServiceNow stock was up 10-fold from 2015 through 2022 but has declined by over 40% from its peak (Figure 23).\nFigure 25 Valuation vs comparablesCreated by author using public financial and stock price dataConcerns1.\nFigure 26 ServiceNow stock-based compensation expenseSeekingAlpha financialsFigure 27 ServiceNow stock-based compensation as % of key financial metricsCreated by authoring using public financial data3.', 'Goldman Sachs sees limited upside for the S&P 500 in 2023 as earnings stay flat.\nHere are 40 stocks that Goldman Sachs analysts believe have the most upside right now.\nUS stocks got off to a choppy start in the first week of 2023, and Goldman Sachs thinks the volatility is only just getting started.\nBut even modest gains are no guarantee this year, given that Goldman Sachs is also calling for flat earnings growth.\n40 high-upside stocks to buyHowever, Goldman Sachs still sees attractive investing opportunities in this turbulent market.']"
2023-01-08,"['Can Shiba Inu Reach $1 in 2023? - Nasdaq', 'Adobe OCR not recognizing text; This page contains renderable text - TheWindowsClub', 'May I have a word about… Adobe’s creative use of language - The Guardian']","['https://news.google.com/rss/articles/CBMiPmh0dHBzOi8vd3d3Lm5hc2RhcS5jb20vYXJ0aWNsZXMvY2FuLXNoaWJhLWludS1yZWFjaC0kMS1pbi0yMDIz0gEA?oc=5', 'https://news.google.com/rss/articles/CBMiQWh0dHBzOi8vd3d3LnRoZXdpbmRvd3NjbHViLmNvbS9hZG9iZS1vY3Itbm90LXJlY29nbml6aW5nLXRleHQtZml40gEA?oc=5', 'https://news.google.com/rss/articles/CBMieWh0dHBzOi8vd3d3LnRoZWd1YXJkaWFuLmNvbS90aGVvYnNlcnZlci9jb21tZW50aXNmcmVlLzIwMjMvamFuLzA4L21heS1pLWhhdmUtYS13b3JkLWFib3V0LWFkb2Jlcy1jcmVhdGl2ZS11c2Utb2YtbGFuZ3VhZ2XSAXlodHRwczovL2FtcC50aGVndWFyZGlhbi5jb20vdGhlb2JzZXJ2ZXIvY29tbWVudGlzZnJlZS8yMDIzL2phbi8wOC9tYXktaS1oYXZlLWEtd29yZC1hYm91dC1hZG9iZXMtY3JlYXRpdmUtdXNlLW9mLWxhbmd1YWdl?oc=5']","[""But there's also Shiba Inu (CRYPTO: SHIB), which has produced a monster return of 529,000% since its launch in August 2020.\nShiba Inu launched with an initial supply of 1 quadrillion tokens.\nThat's because Shiba Inu possesses no real competitive edge among the 22,000 cryptos out there.\nThis makes it almost impossible for Shiba Inu to hit the $1 mark not just in 2023, but ever.\n*They just revealed what they believe are the ten best stocks for investors to buy right now... and Shiba Inu wasn't one of them!"", 'Optical Character Recognition (OCR) may just be better than sliced bread for anyone who must convert pages of text to editable text.\nJust as you are about to do the victory dance you get the error Acrobat could not perform recognition (OCR) on this page because This page contains renderable text.\nAdobe OCR not recognizing textAcrobat Professional has OCR capabilities that allow you to save scanned documents in Rich text format or as Microsoft Word Documents, both Doc and Docx.\nRenderable/editable text Distorted or blurred source Low-quality original Graphics and formsAcrobat could not perform recognition (OCR) on this page because This page contains renderable text1] Renderable/editable textRenderable text is the editable text that exists within the file that you want to do OCR on.\nAcrobat cannot perform OCR on a document that contains renderable text.', 'Well, look at what just landed in my inbox – a very kind invitation from Adobe Creative Cloud, no doubt to stimulate my juices.\nNo, I haven’t got a clue either, but I think that my envelope-pushing days are long behind me and feel that I must graciously decline the kind offer to take part.\nWe have now been afflicted by Covid for nearly three years and yet some lessons still have not been learned.\nTake these two front-page headlines from last week: “Let’s not return to face mask ‘madness’” (Daily Mail); and “Return of the face mask?\nFinally, this week’s prize for masterly concision in the use of the English language goes to Tory MP Tim Loughton reacting to Prince Harry’s latest whinge.']"
2023-01-09,"['15 Most Progressive Companies in America - Yahoo Finance', '7 Best Tech ETFs to Buy for 2023 - WTOP', '15 Best Growth Stocks to Buy According to Hedge Funds - Yahoo Finance', 'Adobe Acrobat Pro, Creative Cloud to require authentication ... - The Daily | Case Western Reserve University', ""Adobe's (NASDAQ:ADBE) PT has been raised to $415.00. - Best Stocks"", ""If You Don't Want To Train DALL-E, Check Your Adobe Creative ... - PC Perspective"", 'Zoom Video Communications Investors Sitting On Loss Of 60% If They Invested A Year Ago - Simply Wall St', 'Reasons to Watch Bank Earnings in 2023 - Value the Markets', 'Elevate Your Photography With Adobe Photoshop Elements for Just $45 - CNET', '3 Undervalued Stocks To Watch Right Now - Nasdaq']","['https://news.google.com/rss/articles/CBMiU2h0dHBzOi8vZmluYW5jZS55YWhvby5jb20vbmV3cy8xNS1tb3N0LXByb2dyZXNzaXZlLWNvbXBhbmllcy1hbWVyaWNhLTIwMjUyMTc2MC5odG1s0gFbaHR0cHM6Ly9maW5hbmNlLnlhaG9vLmNvbS9hbXBodG1sL25ld3MvMTUtbW9zdC1wcm9ncmVzc2l2ZS1jb21wYW5pZXMtYW1lcmljYS0yMDI1MjE3NjAuaHRtbA?oc=5', 'https://news.google.com/rss/articles/CBMiP2h0dHBzOi8vd3RvcC5jb20vbmV3cy8yMDIzLzAxLzctYmVzdC10ZWNoLWV0ZnMtdG8tYnV5LWZvci0yMDIzL9IBAA?oc=5', 'https://news.google.com/rss/articles/CBMiR2h0dHBzOi8vZmluYW5jZS55YWhvby5jb20vbmV3cy8xNS1iZXN0LWdyb3d0aC1zdG9ja3MtYnV5LTIxMTAyMzUyOS5odG1s0gFPaHR0cHM6Ly9maW5hbmNlLnlhaG9vLmNvbS9hbXBodG1sL25ld3MvMTUtYmVzdC1ncm93dGgtc3RvY2tzLWJ1eS0yMTEwMjM1MjkuaHRtbA?oc=5', 'https://news.google.com/rss/articles/CBMiZmh0dHBzOi8vdGhlZGFpbHkuY2FzZS5lZHUvYWRvYmUtYWNyb2JhdC1wcm8tY3JlYXRpdmUtY2xvdWQtdG8tcmVxdWlyZS1hdXRoZW50aWNhdGlvbi1iZWdpbm5pbmctamFuLTEyL9IBAA?oc=5', 'https://news.google.com/rss/articles/CBMiRWh0dHBzOi8vYmVzdHN0b2Nrcy5jb20vYWRvYmVzLW5hc2RhcWFkYmUtcHQtaGFzLWJlZW4tcmFpc2VkLXRvLTQxNS0wL9IBAA?oc=5', 'https://news.google.com/rss/articles/CBMiZGh0dHBzOi8vcGNwZXIuY29tLzIwMjMvMDEvaWYteW91LWRvbnQtd2FudC10by10cmFpbi1kYWxsLWUtY2hlY2steW91ci1hZG9iZS1jcmVhdGl2ZS1jbG91ZC1zZXR0aW5ncy_SAQA?oc=5', 'https://news.google.com/rss/articles/CBMijgFodHRwczovL3NpbXBseXdhbGwuc3Qvc3RvY2tzL3VzL3NvZnR3YXJlL25hc2RhcS16bS96b29tLXZpZGVvLWNvbW11bmljYXRpb25zL25ld3Mvem9vbS12aWRlby1jb21tdW5pY2F0aW9ucy1pbnZlc3RvcnMtc2l0dGluZy1vbi1sb3NzLW9mLTYwLWlm0gGSAWh0dHBzOi8vc2ltcGx5d2FsbC5zdC9zdG9ja3MvdXMvc29mdHdhcmUvbmFzZGFxLXptL3pvb20tdmlkZW8tY29tbXVuaWNhdGlvbnMvbmV3cy96b29tLXZpZGVvLWNvbW11bmljYXRpb25zLWludmVzdG9ycy1zaXR0aW5nLW9uLWxvc3Mtb2YtNjAtaWYvYW1w?oc=5', 'https://news.google.com/rss/articles/CBMiPmh0dHBzOi8vd3d3LnZhbHVldGhlbWFya2V0cy5jb20vYW5hbHlzaXMvYmFuay1lYXJuaW5ncy1pbi0yMDIz0gEA?oc=5', 'https://news.google.com/rss/articles/CBMiXmh0dHBzOi8vd3d3LmNuZXQuY29tL2RlYWxzL2VsZXZhdGUteW91ci1waG90b2dyYXBoeS13aXRoLWFkb2JlLXBob3Rvc2hvcC1lbGVtZW50cy1mb3ItanVzdC00NS_SAWhodHRwczovL3d3dy5jbmV0LmNvbS9nb29nbGUtYW1wL25ld3MvZWxldmF0ZS15b3VyLXBob3RvZ3JhcGh5LXdpdGgtYWRvYmUtcGhvdG9zaG9wLWVsZW1lbnRzLWZvci1qdXN0LTQ1Lw?oc=5', 'https://news.google.com/rss/articles/CBMiR2h0dHBzOi8vd3d3Lm5hc2RhcS5jb20vYXJ0aWNsZXMvMy11bmRlcnZhbHVlZC1zdG9ja3MtdG8td2F0Y2gtcmlnaHQtbm930gEA?oc=5']","['In this article, we will take a look at the 15 most progressive companies in America.\nIf you want to see more companies in this selection, go to the 5 Most Progressive Companies in America.\nThe Progressive Corporation (NYSE:PGR)Number of sources that termed the company as progressive: 2The Progressive Corporation (NYSE:PGR) is a Mayfield, Ohio-based insurance company.\nClick to continue reading and see the 5 Most Progressive Companies in America.\n15 Most Progressive Companies in America is originally published on Insider Monkey.', 'While the energy sector was a success story in 2022, the performance of the tech sector was downright tragic.\nIf you’re thinking long term or if you’re simply aggressive and want a swing-trade success to start the year, here are some leading tech ETFs to consider.\nVanguard Information Technology ETF (VGT)The largest truly sector-specific technology ETF is VGT, with some $39 billion in assets at present.\nBut you’ll also get Korean powerhouse Samsung Electronics Co. Ltd. (SSNLF), along with lesser-known Chinese hardware companies and leading tech companies across Europe.\n7 best tech ETFs to buy for 2023:— Invesco QQQ Trust (QQQ)— Vanguard Information Technology ETF (VGT)— VanEck Semiconductor ETF (SMH)— First Trust Nasdaq Cybersecurity ETF (CIBR)— iShares Expanded Tech-Software Sector ETF (IGV)— iShares Global Tech ETF (IXN)— KraneShares CSI China Internet ETF (KWEB)More from U.S. News7 Top Gene-Editing Stocks to Buy for 202310 of the Best-Performing 401(k) Funds8 Best Commodity ETFs to Buy Now7 Best Tech ETFs to Buy for 2023 originally appeared on usnews.comUpdate 01/10/23: This story was published at an earlier date and has been updated with new information.', 'In this article, we take a look at the 15 best growth stocks to buy according to hedge funds.\nIf you want to see more of the best growth stocks, go directly to 5 Best Growth Stocks to Buy According to Hedge Funds.\nUnitedHealth Group Incorporated (NYSE:UNH)Number of Hedge Fund Holders: 110Health insurance giant UnitedHealth Group Inc. (NYSE:UNH) stands eighth on our list of 15 best growth stocks to buy according to hedge funds.\nAt the end of Q3 2022, 140 hedge funds held Apple Inc. (NASDAQ:AAPL) shares, up from 128 in Q2, taking the seventh spot on our list of 15 best growth stocks to buy according to hedge funds.\n15 Best Growth Stocks to Buy According to Hedge Funds is originally published on Insider Monkey.', 'Beginning Thursday, Jan. 12, users of Adobe Acrobat Pro and Creative Cloud are required to authenticate into the software every two weeks using single sign-on.\nThis is to ensure the security of the software licenses.\nThis does not change the functionality.\nFor assistance with any technology product or service at Case Western Reserve University, contact the University Technology Service Desk at help@case.edu, 216.368.HELP (4357) or visit help.case.edu.', 'According to Piper Sandler’s price objective, the company’s share price could potentially increase by 24.72% compared to its most recent closing price.\nIn a report distributed on StockNews.com on December 12, the rating for Adobe’s stock was changed from “hold” to “buy,” indicating an upward movement in sentiment.\nThere is a 1:14 correlation between the debt-to-equity ratio, the current ratio, and the quick ratio.\nIn related news, Chief Administrative Officer Mark S. Garfield successfully sold 132 company stock on Monday, December 19.\nThe director is now the owner of 383,465 shares of company stock, which have a combined value of $122,555,414 as a direct result of the transaction.', 'You Were Opted Into This By DefaultIt looks like Adobe has been harvesting the art you create on all Adobe Creative Cloud apps to add to data sets being used for machine learning.\nIt is likely that some of the training data is being used to improve Adobe tools you make use of, like the 2D to 3D transform function.\nHowever it also seems probable that Adobe is feeling a little left out of the newest craze, and want in on it.\nWith the huge amount of people using Adobe Creative Cloud every day, they would be able to gather a huge amount of data to build training sets for their own product.\nAdobe doesn’t gather personal info along with your creations, but it seems likely that with enough examples they could easily recognize your style and replicate it.', ""And unfortunately for Zoom Video Communications, Inc. ( ) shareholders, the stock is a lot lower today than it was a year ago.\nUnfortunately Zoom Video Communications reported an EPS drop of 40% for the last year.\nThis free interactive report on Zoom Video Communications' is a great place to start, if you want to investigate the stock further.\nA Different PerspectiveZoom Video Communications shareholders are down 60% for the year, falling short of the market return.\nWhat are the risks and opportunities for Zoom Video Communications ?"", 'As Wall Street has bank earnings in focus this week, investors should take the following factors into consideration.\nProfit MarginsIn 2023, investors in banks have both good and bad news to consider.\nIt remains to be seen if this will be enough to cover any defaults that do occur in 2023.\nTrading StocksSomething that has been good for banks in the past, but may not be as good in 2023, is the revenue they get from trading stocks.\nBank earnings due this week include JPMorgan Chase & Co. (NYSE: JPM), Bank of America Corp. (NYSE: BAC), Wells Fargo & Co. (NYSE: WFC), Citigroup, Inc. (NYSE: C), BlackRock, Inc. (NYSE: BLK), The Bank of New York Mellon Corp. (NYSE: BK), First Republic Bank (NYSE: FRC), and Saratoga Investment Corp. (NYSE: SAR).', 'There are great apps for your phone and software for your computer that are available out there.\nOne of my favorite photo editing software is Adobe Photoshop.\nAdobe is constantly expanding its products and services, and right now you can grab Adobe Photoshop Elements for just $44 on Woot.\nAdobe Photoshop Elements integrates artificial intelligence technology that allows you to turn photos into art, warp photos into any shape, reframe your video subjects and more.\nWith 60 guided edits, you can easily create pictures by extending, removing or replacing photo backgrounds.', 'There are a few key indicators that can help investors identify undervalued stocks, such as a low price-to-earnings ratio and a high dividend yield.\nHowever, for those willing to do their due diligence and carefully research potential investments, undervalued stocks can be a valuable addition to a well-diversified portfolio.\nConsidering this, here are three undervalued stocks to watch in the stock market today.\nUndervalued Stocks To Watch In January 20231.\nSource: TD Ameritrade TOS[Read More] Best Semiconductor Stocks To Invest In Right Now?']"
