datetime,title,link,summary
2023-01-12,"['GoPro (GPRO) Plans to Launch New Streaming Channel by 2023 - Nasdaq', '6 Pros and Cons of Unlimited PTO, Vacation Time for Employees - Bloomberg', 'Is GoPro (NASDAQ:GPRO) A Risky Investment? - Simply Wall St', 'ESG Investing Keeps Pace With Conventional Investing in 2022 - Morningstar', 'Get ready for big tech deals—and IPOs—says top Silicon Valley VC - Yahoo Finance', 'Adobe Tried to Acquire Design Firm Figma for Years Before Co-founder Dylan Field and the ... - Latest Tweet - LatestLY', 'Chili Piper Announces Premier Partnership with Adobe to Optimize ... - GlobeNewswire']","['https://news.google.com/rss/articles/CBMiWGh0dHBzOi8vd3d3Lm5hc2RhcS5jb20vYXJ0aWNsZXMvZ29wcm8tZ3Byby1wbGFucy10by1sYXVuY2gtbmV3LXN0cmVhbWluZy1jaGFubmVsLWJ5LTIwMjPSAQA?oc=5', 'https://news.google.com/rss/articles/CBMib2h0dHBzOi8vd3d3LmJsb29tYmVyZy5jb20vbmV3cy9hcnRpY2xlcy8yMDIzLTAxLTEyLzYtcHJvcy1hbmQtY29ucy1vZi11bmxpbWl0ZWQtcHRvLXZhY2F0aW9uLXRpbWUtZm9yLWVtcGxveWVlc9IBAA?oc=5', 'https://news.google.com/rss/articles/CBMib2h0dHBzOi8vc2ltcGx5d2FsbC5zdC9zdG9ja3MvdXMvY29uc3VtZXItZHVyYWJsZXMvbmFzZGFxLWdwcm8vZ29wcm8vbmV3cy9pcy1nb3Byby1uYXNkYXFncHJvLWEtcmlza3ktaW52ZXN0bWVudNIBc2h0dHBzOi8vc2ltcGx5d2FsbC5zdC9zdG9ja3MvdXMvY29uc3VtZXItZHVyYWJsZXMvbmFzZGFxLWdwcm8vZ29wcm8vbmV3cy9pcy1nb3Byby1uYXNkYXFncHJvLWEtcmlza3ktaW52ZXN0bWVudC9hbXA?oc=5', 'https://news.google.com/rss/articles/CBMiaWh0dHBzOi8vd3d3Lm1vcm5pbmdzdGFyLmNvbS9hcnRpY2xlcy8xMTMyMDA3L2VzZy1pbnZlc3Rpbmcta2VlcHMtcGFjZS13aXRoLWNvbnZlbnRpb25hbC1pbnZlc3RpbmctaW4tMjAyMtIBAA?oc=5', 'https://news.google.com/rss/articles/CBMibWh0dHBzOi8vZmluYW5jZS55YWhvby5jb20vbmV3cy9nZXQtcmVhZHktZm9yLWJpZy10ZWNoLWRlYWxzYW5kLWlwLW9zc2F5cy10b3Atc2lsaWNvbi12YWxsZXktdmMtMjAwNzAyNDYzLmh0bWzSAXVodHRwczovL2ZpbmFuY2UueWFob28uY29tL2FtcGh0bWwvbmV3cy9nZXQtcmVhZHktZm9yLWJpZy10ZWNoLWRlYWxzYW5kLWlwLW9zc2F5cy10b3Atc2lsaWNvbi12YWxsZXktdmMtMjAwNzAyNDYzLmh0bWw?oc=5', 'https://news.google.com/rss/articles/CBMiqgFodHRwczovL3d3dy5sYXRlc3RseS5jb20vc29jaWFsbHkvYnVzaW5lc3MvYWRvYmUtdHJpZWQtdG8tYWNxdWlyZS1kZXNpZ24tZmlybS1maWdtYS1mb3IteWVhcnMtYmVmb3JlLWNvLWZvdW5kZXItZHlsYW4tZmllbGQtYW5kLXRoZS1sYXRlc3QtdHdlZXQtYnktYmxvb21iZXJnLTQ3MDE5MTkuaHRtbNIBrgFodHRwczovL3d3dy5sYXRlc3RseS5jb20vc29jaWFsbHkvYnVzaW5lc3MvYWRvYmUtdHJpZWQtdG8tYWNxdWlyZS1kZXNpZ24tZmlybS1maWdtYS1mb3IteWVhcnMtYmVmb3JlLWNvLWZvdW5kZXItZHlsYW4tZmllbGQtYW5kLXRoZS1sYXRlc3QtdHdlZXQtYnktYmxvb21iZXJnLTQ3MDE5MTkuaHRtbC9hbXA?oc=5', 'https://news.google.com/rss/articles/CBMirgFodHRwczovL3d3dy5nbG9iZW5ld3N3aXJlLmNvbS9lbi9uZXdzLXJlbGVhc2UvMjAyMy8wMS8xMi8yNTg4MDM5LzAvZW4vQ2hpbGktUGlwZXItQW5ub3VuY2VzLVByZW1pZXItUGFydG5lcnNoaXAtd2l0aC1BZG9iZS10by1PcHRpbWl6ZS1MZWFkLUNvbnZlcnNpb24tYW5kLVNhbGVzLVBpcGVsaW5lLmh0bWzSAQA?oc=5']","[""GoPro Inc GPRO has collaborated with Roundtable Entertainment and Cinedigm to develop the GoPro Channel.\nGoPro, Inc. Price and ConsensusGoPro, Inc. price-consensus-chart | GoPro, Inc. QuoteThe GoPro Channel will offer original content chosen from GoPro's collection of sports and lifestyle movies.\nThe Zacks Consensus Estimate for RCI Hospitality’s 2023 earnings is pegged at $5.95 per share, up 2.6% in the past 60 days.\nRCI Hospitality’s earnings beat the Zacks Consensus Estimate in three of the last four quarters, the average being 6.1%.\nThe Zacks Consensus Estimate for Lululemon’s 2023 earnings is pegged at $9.94 per share, up 0.5% in the past 60 days."", 'Why did this happen?\nPlease make sure your browser supports JavaScript and cookies and that you are not blocking them from loading.\nFor more information you can review our Terms of Service and Cookie Policy.', ""But it also has US$348.8m in cash to offset that, meaning it has US$208.0m net cash.\nDespite its noteworthy liabilities, GoPro boasts net cash, so it's fair to say it does not have a heavy debt load!\nBut ultimately the future profitability of the business will decide if GoPro can strengthen its balance sheet over time.\nOver the last three years, GoPro actually produced more free cash flow than EBIT.\nHowever, not all investment risk resides within the balance sheet - far from it."", 'Sustainable investing generated returns similar to those of the overall market in 2022.\nThe broad Morningstar US Sustainability Index fell 18.9% in 2022, outperforming the 19.5% decline of its parent, the Morningstar US Large-Mid Cap Index.\n“These market dynamics were unfavorable for sustainable investments,” says Dan Lefkovitz, strategist for Morningstar Indexes.\nSome Sustainable Indexes OutperformedNot all sustainable indexes were laggards, a reminder that sustainable investing is a big category with many different strategies available to investors.\nSome ESG Funds Outperformed, TooThe top large-cap fund with an ESG bent was tiny Baywood Socially Responsible BVSIX, which fell 0.72% in 2022.', 'Don\'t let all that bad news coming out of Silicon Valley get you down: dealmaking\'s set to pick up in tech-land.\nOr so says Kamran Ansari, Greycroft Board Partner and former Pinterest (PINS) Head of M&A on Yahoo Finance Live (video above).\nParticularly from private equity firms that operate in the tech space – like Thoma Bravo, Vista, and Silver Lake – and large-cap tech buyers themselves, like Amazon, Salesforce, and Oracle,"" said Ansari.\n""In the tech space, I think you have a number of companies, SpaceX and Stripe being the biggest, most-anticipated, most-IPO-ready,"" he said.\n""I think they\'ve cut their internal valuation from $40 billion down to $10 billion and they\'re being realistic about market expectations.', ""Adobe tried to acquire design firm Figma for years before co-founder Dylan Field and the startup finally accepted https://t.co/02dQDO5jYF— Bloomberg (@business) January 12, 2023(SocialLY brings you all the latest breaking news, viral trends and information from social media world, including Twitter, Instagram and Youtube.\nThe above post is embeded directly from the user's social media account and LatestLY Staff may not have modified or edited the content body.\nThe views and facts appearing in the social media post do not reflect the opinions of LatestLY, also LatestLY does not assume any responsibility or liability for the same.)"", 'The partnership ensures the integration of Chili Piper’s technology into the final step of Adobe Marketo Engage’s buyer journey to more efficiently convert a lead into a sales opportunity.\nChili Piper’s integration is projected to raise sales conversion rates by at least 50 percent for Adobe and Chili Piper’s mutual customers.\n“The partnership reinforces Adobe’s confidence in the Chili Piper platform and its ability to convert potential leads into actionable sales scenarios,” said Nicolas Vandenberghe, Co-Founder & Co-CEO, Chili Piper.\nCompanies like Intuit, Twilio, Spotify, and Gong use Chili Piper to double their inbound conversion rates and maximize revenue.\nWith 180 employees in over 30 countries, Chili Piper has been spicing sales up since 2016.']"
2023-01-13,"['Fix Light Flicker in Videos with Adobe Premiere Pro [Tutorial] - TechAcute', ""Spotify's Future Financial Performance Is Too Much Of A Guessing ... - Seeking Alpha"", '3D Modeling Software Tools Market Worth Observing Growth ... - Newstrail', 'Adobe Inc. (ADBE) Is a Trending Stock: Facts to Know Before Betting ... - Nasdaq', 'Why you should turn off Content Analysis in Adobe Creative Cloud ... - iMore', ""Former 'Bachelor' star Nick Viall is engaged to Natalie Joy - Inside NoVA"", 'Meta Stock: Rises From The Ashes (NASDAQ:META) - Seeking Alpha', 'Accenture: Widening Moat Makes It A Promising Buy (NYSE:ACN) - Seeking Alpha', 'The Continuing Growth Story of Music Recording Software Market ... - Newstrail']","['https://news.google.com/rss/articles/CBMiU2h0dHBzOi8vdGVjaGFjdXRlLmNvbS9maXgtbGlnaHQtZmxpY2tlci1pbi12aWRlb3Mtd2l0aC1hZG9iZS1wcmVtaWVyZS1wcm8tdHV0b3JpYWwv0gEA?oc=5', 'https://news.google.com/rss/articles/CBMiZmh0dHBzOi8vc2Vla2luZ2FscGhhLmNvbS9hcnRpY2xlLzQ1Njk2Njktc3BvdGlmeS1zdG9jay1mdXR1cmUtZmluYW5jaWFsLXBlcmZvcm1hbmNlLWd1ZXNzaW5nLWdhbWUtaG9sZNIBAA?oc=5', 'https://news.google.com/rss/articles/CBMiaGh0dHBzOi8vd3d3Lm5ld3N0cmFpbC5jb20vM2QtbW9kZWxpbmctc29mdHdhcmUtdG9vbHMtbWFya2V0LXdvcnRoLW9ic2VydmluZy1ncm93dGgtdHJpbWJsZS1hc3ludGgtYWRvYmUv0gEA?oc=5', 'https://news.google.com/rss/articles/CBMiaWh0dHBzOi8vd3d3Lm5hc2RhcS5jb20vYXJ0aWNsZXMvYWRvYmUtaW5jLi1hZGJlLWlzLWEtdHJlbmRpbmctc3RvY2s6LWZhY3RzLXRvLWtub3ctYmVmb3JlLWJldHRpbmctb24taXQtMNIBAA?oc=5', 'https://news.google.com/rss/articles/CBMieWh0dHBzOi8vd3d3Lmltb3JlLmNvbS9hcHBzL2RyYXdpbmctYXBwcy93aHkteW91LXNob3VsZC10dXJuLW9mZi1jb250ZW50LWFuYWx5c2lzLWluLWFkb2JlLWNyZWF0aXZlLWNsb3VkLWFuZC1ob3ctdG8tZG8taXTSAQA?oc=5', 'https://news.google.com/rss/articles/CBMinwFodHRwczovL3d3dy5pbnNpZGVub3ZhLmNvbS9saWZlc3R5bGVzL2VudGVydGFpbm1lbnQvZm9ybWVyLWJhY2hlbG9yLXN0YXItbmljay12aWFsbC1pcy1lbmdhZ2VkLXRvLW5hdGFsaWUtam95L2FydGljbGVfMTU3ZTkxOWItYWRiZS01YjVlLWFjODgtZTIzZDE2YTFiNjk4Lmh0bWzSAQA?oc=5', 'https://news.google.com/rss/articles/CBMiQmh0dHBzOi8vc2Vla2luZ2FscGhhLmNvbS9hcnRpY2xlLzQ1Njk3NjktbWV0YS1yaXNlcy1mcm9tLXRoZS1hc2hlc9IBAA?oc=5', 'https://news.google.com/rss/articles/CBMiRWh0dHBzOi8vc2Vla2luZ2FscGhhLmNvbS9hcnRpY2xlLzQ1Njk4MzEtYWNjZW50dXJlLWlzLWEtcHJvbWlzaW5nLWJ1edIBAA?oc=5', 'https://news.google.com/rss/articles/CBMibmh0dHBzOi8vd3d3Lm5ld3N0cmFpbC5jb20vdGhlLWNvbnRpbnVpbmctZ3Jvd3RoLXN0b3J5LW9mLW11c2ljLXJlY29yZGluZy1zb2Z0d2FyZS1tYXJrZXQtbWFnaXgtY2FrZXdhbGstYWRvYmUv0gEA?oc=5']","['Share this post saveshareAre you struggling with a light flicker in your videos and need a guide to fix it?\nLuckily, a tool in Adobe Premier Pro can help you quickly and easily correct light flicker issues rapidly and easily.\nWhy light flicker can occur in videosLight flicker in video material can be a real nuisance.\nHow to fix light flicker in videos using Adobe Premiere ProIf you’re looking for an easy way to get rid of that light flicker in your video, Premiere Pro has the perfect solution.\nWhat to do if you can’t fix the light flicker problem in your videoIf you’re experiencing a light flicker in your video and you can’t seem to diagnose or fix the problem yourself, don’t stress.', 'KanchitDon/iStock via Getty ImagesInvestment ThesisSpotify (NYSE:SPOT) is the market leader in music streaming but has not yet turned this into profit.\nIndustry OverviewThe global music streaming market is expected to grow at a compound annual growth rate of 14.7% from 2022 to 2030.\nAdditionally, the future possibilities of VR and AR are expected to create new application areas in the music streaming market.\nThat is an eightfold increase, and an 8x increase in Premium users would correspond to 195M x 8 = 1.56B.\nThese are developing relatively slowly in a positive direction for premium users, but where these could stand in 2025 or even later is a guessing game.', '3D Modeling Software Tools Market 2023-2029.\nA detailed study accumulated to offer the Latest insights about acute features of the 3D Modeling Software Tools market.\n3D Modeling Software Tools Competitive LandscapeIn the competitive analysis section of the 3D Modeling Software Tools Market study, leading as well as prominent players of the 3D Modeling Software Tools market are broadly studied and provides in-depth statistics, market share, position, crucial elements covering drivers & restraining factors to estimate future growth prospects.\nPlayers Profiled in the 3D Modeling Software Tools Market Study:GraphisoftAutodeskDassault SystemesPTC Inc.Siemens PLM SoftwareOracle CorporationTrimbleAsynthUnity TechnologiesMAXONThe Foundry VisionmongersZBrushAdobeBIMx3D Modeling Software ToolsMarket Scope and Market Breakdown3D Modeling Software Tools market is segmented on the basis of type, end-use application and distribution channels.\nThe analysts who have authored the 3D Modeling Software Tools market have taken bottom-up and top-down analysis approach to deliver an in-depth study of the 3D Modeling Software Tools market.', 'This is why empirical research shows a strong correlation between trends in earnings estimate revisions and near-term stock price movements.\nThe Zacks Consensus Estimate has changed +1% over the last 30 days.\nThe consensus earnings estimate of $15.28 for the current fiscal year indicates a year-over-year change of +11.5%.\nFor the next fiscal year, the consensus earnings estimate of $17.30 indicates a change of +13.3% from what Adobe is expected to report a year ago.\nCompared to the Zacks Consensus Estimate of $4.52 billion, the reported revenues represent a surprise of +0.06%.', 'Adobe Creative Cloud added a ""Content Analysis"" section to its privacy and personal data permissions as part of an update.\npic.twitter.com/40wBWYci7VJanuary 4, 2023 See moreThis content analysis for ""Creative Cloud and Document Cloud content includes but [is not] limited to image, audio, video, text or document files, and associated data.""\nHow to turn off content analysis for Adobe Creative CloudEnough with the chatter.\nHere are the simple steps to opting out of Adobe Creative Cloud\'s content analysis.\n(Image credit: iMore)Better safe than sorryAdobe seems to be intentionally making it unclear what exactly content analysis does with user content in Adobe Cloud.', 'Real-time social media posts from local businesses and organizations across Northern Virginia, powered by Friends2Follow.\nTo add your business to the stream, email cfields@insidenova.com or click on the green button below.', ""On October 22, 2021, Meta agreed to purchase Within for about $400 million, part of a plan to expand its presence in the VR fitness space.\nWithin, a software maker that develops apps for VR devices owns a popular fitness app called Supernatural, which is exclusively available for Oculus, Meta's VR headset brand.\nMeta does not have an equivalent VR fitness app but does own Beat Saber, a game that results in some cardiovascular activity.\nBecause Meta and Within don't compete head-on in the VR fitness app space, the deal doesn't increase concentration.\nIt's a high-profile case, already tied to a $5 billion FTC settlement, and Meta could have been hit with statutory damages of $1,000 a person under plaintiffs' lead claim."", ""This is a major factor in my long-term buy suggestion, as Accenture's downside is severely limited, while its growth potential is promising.\nKey Metric Examination and Implied GrowthWhile Accenture's moat is a major contributor to its low risk, Accenture's financial performance (especially when compared to its publicly traded competitors) offers even more security.\nFuture revenue growth is projected at 7.7% YoY through FY 2024, and gross profit (7.2%), as well as diluted EPS (9.64%), also have healthy growth projections (estimates via FactSet composites).\nRisks and Other ConsiderationsAs I've mentioned several times, a major factor in my buy recommendation is Accenture's low risk.\nThe combination of these factors and a healthy dividend/minimal share dilution inform my buy and hold suggestion for Accenture."", 'for more information or any query mail at sales@htfmarketreport.comAt last, all parts of the Music Recording Software Market are quantitatively also subjectively valued to think about the Global just as regional market equally.\nThis market study presents basic data and true figures about the market giving a deep analysis of this market based on market trends, market drivers, constraints and its future prospects.\nWhat are probably the most encouraging, high-development scenarios for Music Recording Software movement showcase by applications, types and regions?\nQ 4.What segments grab most noteworthy attention in Music Recording Software Market in 2022 and beyond?\nQ 5. Who are the significant players confronting and developing in Music Recording Software Market?']"
2023-01-14,"[""The Valentine's Day Vacay You'll Want To Book, Whether You're In ... - The Zoe Report"", 'If You Invested $1,000 in SoFi Technologies a Year Ago, This Is ... - The Motley Fool']","['https://news.google.com/rss/articles/CBMiOmh0dHBzOi8vd3d3LnRoZXpvZXJlcG9ydC5jb20vbGl2aW5nL3ZhbGVudGluZXMtZGF5LWdldGF3YXnSAQA?oc=5', 'https://news.google.com/rss/articles/CBMiXWh0dHBzOi8vd3d3LmZvb2wuY29tL2ludmVzdGluZy8yMDIzLzAxLzE0L2lmLWludmVzdGVkLTEwMDAtaW4tc29maS1hLXllYXItYWdvLWhvdy1tdWNoLXRvZGF5L9IBAA?oc=5']","['Ahead, ideas for a Valentine’s Day getaway based on what you want out of the trip and where you’re located in the country.\nFor the Spa-DwellerSpend your Valentine’s Day slipping into a plush robe and gliding from the steam room to a massage (or facial, or yoga class).\nMii amoSouthwest & SoutheastThe long-awaited reopening of Mii amo lands on February 2 — just in time for Valentine’s Day.\nGood — there are plenty of worthy destinations to indulge on epicurean delights this Valentine’s Day.\nFor an especially atmospheric end to the day, book the two-story Captains Cabin or the Woodland Luxury King Balcony Fireplace room.', ""Fintech businesses had a rotten, no-good year in 2022, but SoFi Technologies' (SOFI -1.12%) 12-month journey seemed especially perilous.\nIt will, without a doubt, be painful for investors to look back at the past year and take stock of the damage done to SoFi Technologies stock.\nA heavy bag to holdAnyone who invested $1,000 in SoFi stock in January of 2022 had unfortunate timing.\nIn other words, the present might still belong to the big banks, but if all goes according to plan, the future could belong to SoFi Technologies.\nGranted, staying with the stock is easier said than done for SoFi Technologies investors who saw $1,000 become $333.""]"
2023-01-15,"['We Think Braze (NASDAQ:BRZE) Can Afford To Drive Business Growth - Simply Wall St', 'Does This Valuation Of Cadence Design Systems, Inc. (NASDAQ:CDNS) Imply Investors Are Overpaying? - Simply Wall St']","['https://news.google.com/rss/articles/CBMifGh0dHBzOi8vc2ltcGx5d2FsbC5zdC9zdG9ja3MvdXMvc29mdHdhcmUvbmFzZGFxLWJyemUvYnJhemUvbmV3cy93ZS10aGluay1icmF6ZS1uYXNkYXFicnplLWNhbi1hZmZvcmQtdG8tZHJpdmUtYnVzaW5lc3MtZ3Jvd3TSAYABaHR0cHM6Ly9zaW1wbHl3YWxsLnN0L3N0b2Nrcy91cy9zb2Z0d2FyZS9uYXNkYXEtYnJ6ZS9icmF6ZS9uZXdzL3dlLXRoaW5rLWJyYXplLW5hc2RhcWJyemUtY2FuLWFmZm9yZC10by1kcml2ZS1idXNpbmVzcy1ncm93dC9hbXA?oc=5', 'https://news.google.com/rss/articles/CBMijwFodHRwczovL3NpbXBseXdhbGwuc3Qvc3RvY2tzL3VzL3NvZnR3YXJlL25hc2RhcS1jZG5zL2NhZGVuY2UtZGVzaWduLXN5c3RlbXMvbmV3cy9kb2VzLXRoaXMtdmFsdWF0aW9uLW9mLWNhZGVuY2UtZGVzaWduLXN5c3RlbXMtaW5jLW5hc2RhcWNkbnMtMdIBkwFodHRwczovL3NpbXBseXdhbGwuc3Qvc3RvY2tzL3VzL3NvZnR3YXJlL25hc2RhcS1jZG5zL2NhZGVuY2UtZGVzaWduLXN5c3RlbXMvbmV3cy9kb2VzLXRoaXMtdmFsdWF0aW9uLW9mLWNhZGVuY2UtZGVzaWduLXN5c3RlbXMtaW5jLW5hc2RhcWNkbnMtMS9hbXA?oc=5']","[""So, the natural question for Braze ( ) shareholders is whether they should be concerned by its rate of cash burn.\nIn this report, we will consider the company's annual negative free cash flow, henceforth referring to it as the 'cash burn'.\nThe first step is to compare its cash burn with its cash reserves, to give us its 'cash runway'.\nIt was quite stunning to see that Braze increased its cash burn by 337% over the last year.\nHow Easily Can Braze Raise Cash?"", ""This will be done using the Discounted Cash Flow (DCF) model.\nWe assume companies with shrinking free cash flow will slow their rate of shrinkage, and that companies with growing free cash flow will see their growth rate slow, over this period.\nFor a number of reasons a very conservative growth rate is used that cannot exceed that of a country's GDP growth.\nIn this case we have used the 5-year average of the 10-year government bond yield (2.0%) to estimate future growth.\nThe Simply Wall St app conducts a discounted cash flow valuation for every stock on the NASDAQGS every day.""]"
2023-01-16,"['Are Your Adobe Cloud Images Being Used to Train Its AI? - The Phoblographer', 'Campaign Management Software Market to See Revolutionary ... - Newstrail']","['https://news.google.com/rss/articles/CBMiYmh0dHBzOi8vd3d3LnRoZXBob2Jsb2dyYXBoZXIuY29tLzIwMjMvMDEvMTYvdW5kZXJzdGFuZGluZy1hZG9iZS1hbmQtaXRzLWFpLXVzZS1vZi1pbWFnZXMtYW5kLWRhdGEv0gEA?oc=5', 'https://news.google.com/rss/articles/CBMibWh0dHBzOi8vd3d3Lm5ld3N0cmFpbC5jb20vY2FtcGFpZ24tbWFuYWdlbWVudC1zb2Z0d2FyZS1tYXJrZXQtdG8tc2VlLXJldm9sdXRpb25hcnktZ3Jvd3RoLXpvaG8taWJtLXNhcy1hZG9iZS_SAQA?oc=5']","['It’s possible that images stored in your account there are being used to train Adobe’s AI.\nAdobe looks to have been using images and files from its Creative Cloud users, possibly without clearly letting its users know it’s doing so.\nData and files in your Adobe Cloud account are clubbed together with similar content from other users.\nOr does this mean I can use them, but data and images using AI-assisted edit features will be used by Adobe?\nYou might be worried that your cloud data is manually reviewed by employees there.', 'At last, all parts of the Global Campaign Management Software Market are quantitatively also subjectively valued to think about the Global just as regional market equally.\nThis market study presents basic data and true figures about the market giving a deep analysis of this market based on market trends, market drivers, constraints and its future prospects.\nWhat are probably the most encouraging, high-development scenarios for Campaign Management Software movement showcase by applications, types and regions?\nQ 4.What segments grab most noteworthy attention in Campaign Management Software Market in 2020 and beyond?\nQ 5. Who are the significant players confronting and developing in Campaign Management Software Market?']"
