datetime,title,link,summary
2023-01-01,"['Adobe Stock: Bull vs. Bear - The Motley Fool', '4 Cryptocurrencies That Can Triple Your Money in 2023 - Nasdaq', 'Tulsa King Season 1 Episode 8 Review: Adobe Walls - TV Fanatic']","['https://news.google.com/rss/articles/CBMiQ2h0dHBzOi8vd3d3LmZvb2wuY29tL2ludmVzdGluZy8yMDIzLzAxLzAxL2Fkb2JlLXN0b2NrLWJ1bGwtdnMtYmVhci_SAQA?oc=5', 'https://news.google.com/rss/articles/CBMiVWh0dHBzOi8vd3d3Lm5hc2RhcS5jb20vYXJ0aWNsZXMvNC1jcnlwdG9jdXJyZW5jaWVzLXRoYXQtY2FuLXRyaXBsZS15b3VyLW1vbmV5LWluLTIwMjPSAQA?oc=5', 'https://news.google.com/rss/articles/CBMiU2h0dHBzOi8vd3d3LnR2ZmFuYXRpYy5jb20vMjAyMy8wMS90dWxzYS1raW5nLXNlYXNvbi0xLWVwaXNvZGUtOC1yZXZpZXctYWRvYmUtd2FsbHMv0gEA?oc=5']","[""Like many other software stocks, Adobe (ADBE -6.35%) has seen turbulent trading over the last year.\nRead on to see why two Motley Fool contributors come down on opposite sides of the bull versus bear debate on Adobe stock.\nAdobe's profit growth is slowingParkev Tatevosian: Before I make my bear case for Adobe stock, I would like to say I think the stock is a good value right now.\nShould investors buy Adobe stock today?\nAdobe is a strong company, but there are still risk factors that could lead to continued turbulence for the stock."", ""As we open the curtain to a new year, the following four cryptocurrencies stand out as having the potential to triple your money in 2023.\nAvalancheWhen it comes to innovation and tangible results, Ethereum (CRYPTO: ETH) tends to lead the pack.\nAlgorandThe second cryptocurrency capable of delivering 200% returns to investors in 2023, if things go its way, is Algorand (CRYPTO: ALGO).\nIOTAA third cryptocurrency that has the potential to triple your money in 2023 -- and that's certainly off the radar when compared to Avalanche and Algorand -- is IOTA (CRYPTO: MIOTA).\nStellarThe fourth and final cryptocurrency that can triple your money in 2023 is Stellar (CRYPTO: XLM)."", ""Tulsa King Season 1 Episode 8 offers more of what we've come to expect -- moving chess pieces around on a board while we wait for something to happen.\nSo far, Tulsa King has been a lot more buildup than actual storytelling.\nDwight needs Tyson, and the less Tyson knows about the business, the more helpful he'll be in the long run.\nBut he does inspire people, and the showdown coming on the Tulsa King Season 1 finale (already??)\nHopefully, Tulsa King Season 2 will be less world-building and more plain fun, but it could be Dwight's journey to continuously build to something that might never come to fruition.""]"
2023-01-02,"['23 Top Stocks to Buy for 2023 - Nasdaq', '23 Top Stocks to Buy for 2023 - The Motley Fool', 'Big Tech will ‘have a better year’ in 2023, analyst says - Yahoo Finance', 'Ken Fisher’s Top 15 Growth Stock Picks - Yahoo Finance', 'Kevin Hart Walks Out to Canon Song at Adobe Max Creativity ... - Rapzilla.com']","['https://news.google.com/rss/articles/CBMiPWh0dHBzOi8vd3d3Lm5hc2RhcS5jb20vYXJ0aWNsZXMvMjMtdG9wLXN0b2Nrcy10by1idXktZm9yLTIwMjPSAQA?oc=5', 'https://news.google.com/rss/articles/CBMiSGh0dHBzOi8vd3d3LmZvb2wuY29tL2ludmVzdGluZy8yMDIzLzAxLzAyLzIzLXRvcC1zdG9ja3MtdG8tYnV5LWZvci0yMDIzL9IBAA?oc=5', 'https://news.google.com/rss/articles/CBMiY2h0dHBzOi8vZmluYW5jZS55YWhvby5jb20vbmV3cy9iaWctdGVjaC13aWxsLWhhdmUtYS1iZXR0ZXIteWVhci1pbi0yMDIzLWFuYWx5c3Qtc2F5cy0xNjIzMjU3MTguaHRtbNIBa2h0dHBzOi8vZmluYW5jZS55YWhvby5jb20vYW1waHRtbC9uZXdzL2JpZy10ZWNoLXdpbGwtaGF2ZS1hLWJldHRlci15ZWFyLWluLTIwMjMtYW5hbHlzdC1zYXlzLTE2MjMyNTcxOC5odG1s?oc=5', 'https://news.google.com/rss/articles/CBMiRmh0dHBzOi8vZmluYW5jZS55YWhvby5jb20vbmV3cy9rZW4tZmlzaGVyLXRvcC0xNS1ncm93dGgtMTkwNTAwMTAxLmh0bWzSAU5odHRwczovL2ZpbmFuY2UueWFob28uY29tL2FtcGh0bWwvbmV3cy9rZW4tZmlzaGVyLXRvcC0xNS1ncm93dGgtMTkwNTAwMTAxLmh0bWw?oc=5', 'https://news.google.com/rss/articles/CBMiV2h0dHBzOi8vcmFwemlsbGEuY29tLzIwMjMtMDEta2V2aW4taGFydC1jYW5vbi1wb2V0aWNzLXNvbmctYWRvYmUtY3JlYXRpdml0eS1jb25mZXJlbmNlL9IBAA?oc=5']","['', ""Suzanne Frey, an executive at Alphabet, is a member of The Motley Fool's board of directors.\nParkev Tatevosian, CFA has positions in 3m, Airbnb, Alphabet, Chegg, DocuSign, Mastercard, MercadoLibre, Palo Alto Networks, PayPal, Starbucks, Visa, Walt Disney, and eBay and has the following options: long January 2024 $105 calls on Walt Disney.\nThe Motley Fool has a disclosure policy.\nParkev Tatevosian is an affiliate of The Motley Fool and may be compensated for promoting its services.\nHis opinions remain his own and are unaffected by The Motley Fool."", 'Though it\'s been a bleak year for the sector, Big Tech could be set to rebound in 2023, Constellation Research Principal Analyst and Founder R “Ray” Wang told Yahoo Finance Live (video above).\nHowever, I actually think it\'s going to be a better year in 2023 ... Apple\'s (AAPL) in a good position in the long-run and they\'ve got great services.\n""We love the enterprise tech stocks,"" he said.\n""If you look at an Adobe, ServiceNow, or Workday, if you look at these companies, they\'re doing really well going forward because they also have these long-term enterprise tech contracts.\nThey\'re really strong buys.""', ""In this article, we will take a look at Ken Fisher’s top 15 growth stock picks.\nIf you want to see more stocks in this selection, go to Ken Fisher’s Top 5 Growth Stock Picks.\nKen Fisher's Top 15 Growth Stock PicksOur MethodologyWe have selected the top 15 growth stocks from the Q3 2022 portfolio of Fisher Asset Management.\nClick to continue reading and see Ken Fisher’s Top 5 Growth Stock Picks.\nKen Fisher’s Top 15 Growth Stock Picks is originally published on Insider Monkey."", 'Superstar comedian and actor Kevin Hart was a guest speaker at the Adobe Max 2022 Creativity Conference.\nAs he entered the stage, the DJ played the familiar voice of Canon over the speakers.\n“Ever since I stopped focusing on everyone else’s wins I started catching my own.\nLife been hittin different lately 🔥🚀 Much love to @kevinhart4real, @adobe, and the Dj for showing love!\nView this post on Instagram A post shared by Canon (@getthecanon)Listen to Canon Below:']"
2023-01-03,"['15 Most Valuable Silicon Valley Companies in the World - Yahoo Finance', 'Best Oil Stocks To Buy For 2023? 3 For Your List - Nasdaq', 'Adobe Launches Enhance Speech, A Free Service That Turns ... - Tech News Space', 'How to Open a PDF in Full Screen Mode Using Adobe Acrobat on ... - Guiding Tech', 'How to Animate Snow With Adobe After Effects - MUO - MakeUseOf', 'Amazon and Adobe among brands influencers like working with most - AdAge.com', ""Tech trends for 2023 from Adobe's chief product officer - Business Insider""]","['https://news.google.com/rss/articles/CBMiTWh0dHBzOi8vZmluYW5jZS55YWhvby5jb20vbmV3cy8xNS1tb3N0LXZhbHVhYmxlLXNpbGljb24tdmFsbGV5LTE0MTcxMzY4MS5odG1s0gFVaHR0cHM6Ly9maW5hbmNlLnlhaG9vLmNvbS9hbXBodG1sL25ld3MvMTUtbW9zdC12YWx1YWJsZS1zaWxpY29uLXZhbGxleS0xNDE3MTM2ODEuaHRtbA?oc=5', 'https://news.google.com/rss/articles/CBMiT2h0dHBzOi8vd3d3Lm5hc2RhcS5jb20vYXJ0aWNsZXMvYmVzdC1vaWwtc3RvY2tzLXRvLWJ1eS1mb3ItMjAyMy0zLWZvci15b3VyLWxpc3TSAQA?oc=5', 'https://news.google.com/rss/articles/CBMieWh0dHBzOi8vdGVjaG5ld3NzcGFjZS5jb20vYWRvYmUtbGF1bmNoZXMtZW5oYW5jZS1zcGVlY2gtYS1mcmVlLXNlcnZpY2UtdGhhdC10dXJucy1tZWRpb2NyZS1zcGVlY2gtaW50by1zdHVkaW8tcmVjb3JkaW5ncy_SAQA?oc=5', 'https://news.google.com/rss/articles/CBMiYWh0dHBzOi8vd3d3Lmd1aWRpbmd0ZWNoLmNvbS9ob3ctdG8tb3Blbi1hLXBkZi1pbi1mdWxsLXNjcmVlbi1tb2RlLXVzaW5nLWFkb2JlLWFjcm9iYXQtb24td2luZG93cy_SAQA?oc=5', 'https://news.google.com/rss/articles/CBMiQmh0dHBzOi8vd3d3Lm1ha2V1c2VvZi5jb20vYWRvYmUtYWZ0ZXItZWZmZWN0cy1ob3ctdG8tYW5pbWF0ZS1zbm93L9IBAA?oc=5', 'https://news.google.com/rss/articles/CBMicGh0dHBzOi8vYWRhZ2UuY29tL2FydGljbGUvbWFya2V0aW5nLW5ld3Mtc3RyYXRlZ3kvYW1hem9uLWFuZC1hZG9iZS1hbW9uZy1icmFuZHMtaW5mbHVlbmNlcnMtd29ya2luZy1tb3N0LzI0NjE2NDHSAQA?oc=5', 'https://news.google.com/rss/articles/CBMiXmh0dHBzOi8vd3d3LmJ1c2luZXNzaW5zaWRlci5jb20vdGVjaC10cmVuZHMtZm9yLTIwMjMtZnJvbS1hZG9iZXMtY2hpZWYtcHJvZHVjdC1vZmZpY2VyLTIwMjItMTLSAWJodHRwczovL3d3dy5idXNpbmVzc2luc2lkZXIuY29tL3RlY2gtdHJlbmRzLWZvci0yMDIzLWZyb20tYWRvYmVzLWNoaWVmLXByb2R1Y3Qtb2ZmaWNlci0yMDIyLTEyP2FtcA?oc=5']","[""In this article, we take a look at 15 of the most valuable silicon valley companies in the world.\nIf you want to see more of the most valuable silicon valley companies in the world, go directly to 5 Most Valuable Silicon Valley Companies in the World.\nIntel, Semiconductor, ChipPhoto by Slejven Djurakovic on UnsplashMethodologyFor our list of 15 Most Valuable Silicon Valley Companies in the World, we took the 15 most valuable companies with headquarters in Silicon Valley from companiesmarketcap.com's Largest tech companies by market cap list.\nFor more valuable companies, check out 15 Most Valuable NASDAQ Companies in the World.\n15 Most Valuable Silicon Valley Companies in the World is originally published on Insider Monkey."", 'Oil stocks refer to stocks of companies that are involved in the exploration, extraction, refining, and distribution of oil and gas.\nInvesting in oil stocks can be a potentially lucrative endeavor.\nHowever, investing in oil stocks also carries a certain level of risk.\nWith this in mind, here are three oil stocks for your 2023 stock market watchlist.\nOil Stocks To Buy [Or Avoid] In January 2023Occidental Petroleum (OXY Stock)Leading off, Occidental Petroleum Corporation (OXY) is an American multinational oil and gas exploration and production company.', 'Adobe has launched the free Enhance Speech service, which uses a special AI algorithm to cleanse speech recordings of extraneous noise and improve sound quality.\nAlready on duty available anyone who wants to enhance their podcasts, audio to video and other recordings.\nAccording to Adobe, the featured service is capable of taking recordings made with an average microphone to the point where they sound like they were recorded in a professional studio.\nEnhance Speech is free to use but requires an Adobe account to interact with.\nEnhance Speech is reportedly part of the Adobe Podcast project aimed at podcast creators.', 'Adobe Acrobat lets you view a PDF file in full screen mode.\nHere’s how to open a PDF in full screen mode using Adobe Acrobat on your Windows 11 computer.\nYou can do the same with a PDF file using Adobe Acrobat or Acrobat Reader.\nThe steps above work for Adobe Acrobat DC, and Adobe Acrobat Reader apps.\nAlso on Guiding Tech Top 4 Ways to Open PDF Document in Adobe Reader Instead of Browser Read MoreRe-Ordering a PDF Using Adobe AcrobatNow that your PDF is in full screen mode, you can easily use it for your presentations.', '', 'The best brands “treat influencers like humans.\nIt will use FYPM’s roughly 10,000 influencer reviews (and counting) to help brands evaluate whether they’re paying influencers below, on par with, or above the industry average, Lugrin said.\nIn each review, influencers were asked to provide a one to five rating on their overall experience working with the brand, with five being the highest and one being the lowest.\nPositive reviews were defined as those with an overall rating of four or five, whereas negative reviews had ratings of one or two.\nInfluencers are required to have collaborated with a brand before reviewing it on the platform.', 'Internet browsers will shift from generalized to specializedAs web apps, communal browsing, and decentralized technology continue to grow, browsers have become too generalized and antiquated for the future of web apps.\nWeb apps offer virality and infinite possibilities for product-led growth, and are finally powerful enough for sophisticated apps like Photoshop.\nBrowsers will be reimagined for collaboration and higher performance web apps — like Arc from The Browser Company.\nAs a result, the value of creative work will shift from outcomes to process and ingenuity.\nContent creators will own their audience and some will become ""platform-less""Content creators with mass audiences are seeking novel ways to own the relationship.']"
2023-01-04,"['8 Top-Performing Fidelity Funds for Retirement - WTOP', 'General Electric Shares Rise As It Completes Spin-off Of GE ... - Nasdaq', 'Terry Smith sells two tech stocks after big losses - Interactive Investor', '‘Boring’ Intuit Stock (NASDAQ: INTU) May Benefit from a Workplace ... - TipRanks', '4 stocks to watch on Wednesday: Salesforce, GE and more (NYSE ... - Seeking Alpha', 'Emerging Trend: Software as a Service Customer Relationship ... - Digital Journal']","['https://news.google.com/rss/articles/CBMiT2h0dHBzOi8vd3RvcC5jb20vbmV3cy8yMDIzLzAxLzgtdG9wLXBlcmZvcm1pbmctZmlkZWxpdHktZnVuZHMtZm9yLXJldGlyZW1lbnQtMi_SAQA?oc=5', 'https://news.google.com/rss/articles/CBMic2h0dHBzOi8vd3d3Lm5hc2RhcS5jb20vYXJ0aWNsZXMvZ2VuZXJhbC1lbGVjdHJpYy1zaGFyZXMtcmlzZS1hcy1pdC1jb21wbGV0ZXMtc3Bpbi1vZmYtb2YtZ2UtaGVhbHRoY2FyZS10ZWNobm9sb2dpZXPSAQA?oc=5', 'https://news.google.com/rss/articles/CBMiZGh0dHBzOi8vd3d3LmlpLmNvLnVrL2FuYWx5c2lzLWNvbW1lbnRhcnkvdGVycnktc21pdGgtc2VsbHMtdHdvLXRlY2gtc3RvY2tzLWFmdGVyLWJpZy1sb3NzZXMtaWk1MjY0NjXSAQA?oc=5', 'https://news.google.com/rss/articles/CBMib2h0dHBzOi8vd3d3LnRpcHJhbmtzLmNvbS9uZXdzL2FydGljbGUvYm9yaW5nLXRheC1wcmVwLXNvZnR3YXJlLXByb3ZpZGVyLWludHVpdC1pbnR1LXN0b2NrLWJhbmtzLXdvcmtwbGFjZS1waXZvdNIBAA?oc=5', 'https://news.google.com/rss/articles/CBMiW2h0dHBzOi8vc2Vla2luZ2FscGhhLmNvbS9uZXdzLzM5MjE5MDgtNC1zdG9ja3MtdG8td2F0Y2gtb24td2VkbmVzZGF5LXNhbGVzZm9yY2UtZ2UtYW5kLW1vcmXSAQA?oc=5', 'https://news.google.com/rss/articles/CBMivwFodHRwczovL3d3dy5kaWdpdGFsam91cm5hbC5jb20vcHIvZW1lcmdpbmctdHJlbmQtc29mdHdhcmUtYXMtYS1zZXJ2aWNlLWN1c3RvbWVyLXJlbGF0aW9uc2hpcC1tYW5hZ2VtZW50LW1hcmtldC1kZXRhaWxlZC1hbmFseXNpcy1ieS1maWd1cmVzLXZpZXdwb2ludC0yMDMwLWFkb2JlLWluYy1uYXNkYXEtYWRiZS1taWNyb3NvZnQtY29ycNIBAA?oc=5']","['These Fidelity funds still had the highest 10-year returns despite incurring losses in 2022.\nWith 322 mutual funds in their…These Fidelity funds still had the highest 10-year returns despite incurring losses in 2022.\nFrom straightforward, low-cost index funds to actively managed sector and thematic funds, Fidelity has it all.\nFidelity Select Health Care Services Portfolio (FSHCX)The health care sector is fairly broad and can encompass companies involved in a wide variety of products and services.\n8 top-performing Fidelity funds for retirement:— Fidelity Select Retailing Portfolio (FSRPX)— Fidelity Select Health Care Portfolio (FSPHX)— Fidelity Select Health Care Services Portfolio (FSHCX)— Fidelity OTC Portfolio (FOCPX)— Fidelity Select Technology Portfolio (FSPTX)— Fidelity Select Medical Technology and Devices Portfolio (FSMEX)— Fidelity Select Software and IT Services Portfolio (FSCSX)— Fidelity Select Semiconductors Portfolio (FSELX)More from U.S. News7 Best Socially Responsible FundsTax-Loss Harvesting: The Bright Side to 2022’s Sell-off7 Stocks That Outperform in a Recession8 Top-Performing Fidelity Funds for Retirement originally appeared on usnews.comUpdate 01/05/23: This story was previously published at an earlier date and has been updated with new information.', '(RTTNews) - Shares of General Electric Company (GE) are gaining over 2% on Wednesday morning after the company announced it has completed the separation of its healthcare business, launching GE HealthCare Technologies Inc.GE is currently trading at $67.85, up $1.54 or 2.32%, on the NYSE.\nStarting January 4, 2023, GE HealthCare will trade on Nasdaq under the ticker symbol ""GEHC"".\nHolders of GE common stock received one share of GE HealthCare common stock for every three shares of GE common stock held.\nThe distribution was part of a tax-free spin-off, resulting in tax efficiency for GE shareholders in the U.S.\nThe views and opinions expressed herein are the views and opinions of the author and do not necessarily reflect those of Nasdaq, Inc.', 'The US firms were this time last year top 10 holdings, but after a tough period for expensive shares have been sold.\nStar fund manager Terry Smith has sold online payments firm PayPal and accounting software group Intuit from his £22.5 billion Fundsmith Equity fund.\n“We sold our stakes in Intuit and PayPal during the month,” Smith wrote in his December 2022 update to investors.\nIntuit shares fell 36% last year, while PayPal’s dropped 63%.\nBlue Whale Growth fund manager Stephen Yiu sold the company in February 2022, but Nick Train’s Lindsell Train Global Equity still holds it.', 'Not surprisingly, INTU stock doesn’t benefit from simple W-2s.\nCorporate Standoffs Cynically Boost INTU StockTo be sure, INTU stock doesn’t natively appear as a resoundingly bullish opportunity.\nThis backdrop then supports INTU stock as people abandon their employers with the aim of working under their own terms.\nTurning to Wall Street, INTU stock has a Strong Buy consensus rating based on 18 Buys assigned in the past three months.\nPositive Fiscal Momentum May Lift Intuit Stock in 2023While Intuit doesn’t always attract retail investors’ attention, market participants should note that presently, INTU stock carries a consensus strong buy rating.', 'Here are some stocks to watch on Wednesday:Salesforce ( NYSE: CRM cut about 10% of its workforce, as part of a restructuring plan that will lead to $1.4B-$2.1B in charges.\ncut about 10% of its workforce, as part of a restructuring plan that will lead to $1.4B-$2.1B in charges.\nGE (GE) revealed that it has completed the spinoff of its healthcare unit.\nGE said it still plans to separate two more units, GE Aerospace and GE Vernova, early next year.\nTurning away from the stock market, see why Seeking Alpha contributor Ryan Wilday sees ""more rough waters ahead"" for Bitcoin.', '» The Software as a Service Customer Relationship Management report is compiled with a thorough and dynamic research methodology.\n» The report offers a complete picture of the competitive scenario of the Software as a Service Customer Relationship Management market.\n» It comprises a vast amount of information about the latest technology and product developments in the Software as a Service Customer Relationship Management industry.\n» The Software as a Service Customer Relationship Management report has combined the required essential historical data and analysis in the comprehensive research report.\nHow will they impact the Software as a Service Customer Relationship Management Market?']"
2023-01-05,"['U.S. Wide-Moat Stocks On Sale: The January 2023 Heat Map - Seeking Alpha', 'Online holiday shopping hit new record, Adobe says - Digital Commerce 360', 'Invest in Defensive ETFs as Recession Fear Grows in 2023 - Nasdaq', 'Top Analyst Reports for Alphabet, Novo Nordisk & TotalEnergies - Yahoo Finance', 'CDW Corp. stock falls Thursday, underperforms market - MarketWatch']","['https://news.google.com/rss/articles/CBMiXmh0dHBzOi8vc2Vla2luZ2FscGhhLmNvbS9hcnRpY2xlLzQ1NjgxMzAtdXMtd2lkZS1tb2F0LXN0b2Nrcy1vbi1zYWxlLXRoZS1qYW51YXJ5LTIwMjMtaGVhdC1tYXDSAQA?oc=5', 'https://news.google.com/rss/articles/CBMiYGh0dHBzOi8vd3d3LmRpZ2l0YWxjb21tZXJjZTM2MC5jb20vMjAyMy8wMS8wNS9vbmxpbmUtaG9saWRheS1zaG9wcGluZy1oaXQtbmV3LXJlY29yZC1hZG9iZS1zYXlzL9IBZGh0dHBzOi8vd3d3LmRpZ2l0YWxjb21tZXJjZTM2MC5jb20vMjAyMy8wMS8wNS9vbmxpbmUtaG9saWRheS1zaG9wcGluZy1oaXQtbmV3LXJlY29yZC1hZG9iZS1zYXlzL2FtcC8?oc=5', 'https://news.google.com/rss/articles/CBMiWGh0dHBzOi8vd3d3Lm5hc2RhcS5jb20vYXJ0aWNsZXMvaW52ZXN0LWluLWRlZmVuc2l2ZS1ldGZzLWFzLXJlY2Vzc2lvbi1mZWFyLWdyb3dzLWluLTIwMjPSAQA?oc=5', 'https://news.google.com/rss/articles/CBMiT2h0dHBzOi8vZmluYW5jZS55YWhvby5jb20vbmV3cy90b3AtYW5hbHlzdC1yZXBvcnRzLWFscGhhYmV0LW5vdm8tMTg0ODA2MjQxLmh0bWzSAVdodHRwczovL2ZpbmFuY2UueWFob28uY29tL2FtcGh0bWwvbmV3cy90b3AtYW5hbHlzdC1yZXBvcnRzLWFscGhhYmV0LW5vdm8tMTg0ODA2MjQxLmh0bWw?oc=5', 'https://news.google.com/rss/articles/CBMibWh0dHBzOi8vd3d3Lm1hcmtldHdhdGNoLmNvbS9zdG9yeS9jZHctY29ycC1zdG9jay1mYWxscy10aHVyc2RheS11bmRlcnBlcmZvcm1zLW1hcmtldC0wMTY3Mjk1NTAxOC0yOTY3NTFlYzg2NjjSAXVodHRwczovL3d3dy5tYXJrZXR3YXRjaC5jb20vYW1wL2RhdGEtbmV3cy9jZHctY29ycC1zdG9jay1mYWxscy10aHVyc2RheS11bmRlcnBlcmZvcm1zLW1hcmtldC0wMTY3Mjk1NTAxOC0yOTY3NTFlYzg2Njg?oc=5']","['Based on the available data, stocks with a wide-moat rating that also fit into the 4- or 5-star category deserve to be the subject of further analysis.\nWe focus on those companies that are covered by a Morningstar analyst as assigning a wide-moat rating without thorough analysis is a questionable practice in our opinion.\nAs of January 5, there were 144 U.S. wide-moat stocks meeting our criteria (unchanged from last month).\nOnly 9.0% (13 stocks) of this wide-moat group earned a 5-star (most attractive) valuation rating.\nFor us, only those stocks are allowed to appear on the heat map in our third step that seem attractively valued in both a short-term and long-term context.', 'advertisement Get the ResourceDiscounts attracted online shoppersAcross major ecommerce categories, discounts hit record highs this holiday season.\nadvertisementToys drove online holiday salesOnline sales of toys jumped 206% compared to pre-season levels in October 2022.\nSubcategories that saw strong demand in online holiday shopping:Watches (up 108%)Baby toys (up 101%)Gift cards (up 98%)Cosmetics (up 90%)Outdoor grills (up 86%)Speakers (up 76%)Smart home products (up 67%)Additional insights: Online holiday shoppingMobile shopping: This holiday season, 47% of online sales came through smartphones (up from 43% in 2021).\nChristmas Day (Dec. 25) set a new mobile record, driving the majority of online sales at 61% (up from 58%).\nMarketing channels: Paid search remained the biggest driver of sales for retailers this holiday season (29% of online sales attributable to that channel).', 'It follows the Utilities Select Sector Index, holding 30 stocks in its basket.\nUtilities Select Sector SPDR charges 10 bps in annual fees and sees a heavy volume of around 11 million shares, on average.\nInvesco Dynamic Food & Beverage ETF offers exposure to 31 stocks engaged in the manufacture, sale, or distribution of food and beverage products, agricultural products and products related to the development of new food technologies by tracking the Dynamic Food & Beverage Intellidex Index.\nWith AUM of $368.6 million, Invesco Dynamic Food & Beverage ETF charges 63 bps in annual fees from investors and sees a moderate average daily volume of 66,000 shares.\niShares MSCI USA Quality Factor ETF holds 124 securities in its basket and trades in an average daily volume of 1 million shares.', ""Today's Research Daily features new research reports on 16 major stocks, including Alphabet Inc. (GOOGL), Adobe Inc. (ADBE) and TotalEnergies SE (TTE).\nThese research reports have been hand-picked from the roughly 70 reports published by our analyst team today.\nStrength in Aviation & Outdoor Segments Aids Garmin (GRMN)Per the Zacks analyst, growing demand for adventure watches is driving Garmin's outdoor segment.\nNew UpgradesNovo Nordisk (NVO) Rides High on Robust Diabetes Drugs SalesPer the Zacks analyst, Novo Nordisk has a strong presence in the Diabetes Care market which is driving growth.\nClick to get this free reportConocoPhillips (COP) : Free Stock Analysis ReportNovo Nordisk AS (NVO) : Free Stock Analysis ReportAdobe Inc. (ADBE) : Free Stock Analysis ReportDiageo plc (DEO) : Free Stock Analysis ReportAlphabet Inc. (GOOGL) : Free Stock Analysis ReportTotalEnergies SE Sponsored ADR (TTE) : Free Stock Analysis ReportTo read this article on Zacks.com click here."", ""Shares of CDW Corp. CDW slipped 1.71% to $178.06 Thursday, on what proved to be an all-around rough trading session for the stock market, with the S&P 500 Index SPX falling 1.16% to 3,808.10 and Dow Jones Industrial Average DJIA falling 1.02% to 32,930.08.\nThe stock's fall snapped a two-day winning streak.\nCDW Corp. closed $28.56 below its 52-week high ($206.62), which the company reached on January 6th.\nDespite its losses, the stock outperformed some of its competitors Thursday, as Amazon.com Inc. AMZN fell 2.37% to $83.12,...""]"
